{
  "schemaVersion": 1,
  "id": "app-start-v1",
  "title": "Application start",
  "description": "Measure new-process launch to painted and trusted-input-ready application surface.",
  "kind": "app-start",
  "corpusId": "opencode-completed-transcripts-v1",
  "cases": {
    "startModes": ["new-application-state", "initialized-application-state"]
  },
  "metrics": [
    {
      "id": "start.duration_ms",
      "description": "Elapsed monotonic time immediately before process spawn until the 1 MiB anchor transcript is correctly painted across two presentation opportunities and the composer accepts trusted input.",
      "unit": "ms"
    }
  ],
  "runProfiles": {
    "smoke": 3,
    "quick": 5,
    "publication": 20
  }
}
